{
  "$schema": "https://json-schema.org/draft/2020-12/schema",
  "title": "scene_semantics.json: the output of DexAgent Stage 1",
  "type": "object",
  "required": ["task_prompt", "task_summary", "environment", "hands", "objects", "subgoals", "task_success"],
  "additionalProperties": true,
  "properties": {
    "task_prompt": {"type": "string", "description": "The prompt as given."},
    "task_summary": {"type": "string", "description": "One sentence: which hand does what to which object, in order."},
    "video": {"type": "object", "description": "Clip facts read with probe_video: path, duration_s, fps, frames."},
    "environment": {
      "type": "object", "required": ["support_surface"],
      "properties": {
        "support_surface": {"type": "string", "description": "What everything rests on. Never an object."},
        "camera": {"type": "string", "description": "Where the camera is and whether it moves."},
        "notes": {"type": "string"}
      }
    },
    "hands": {
      "type": "object", "required": ["used"],
      "properties": {
        "used": {"type": "array", "items": {"enum": ["left", "right"]}},
        "notes": {"type": "string"}
      }
    },
    "objects": {
      "type": "array", "minItems": 1,
      "items": {
        "type": "object",
        "required": ["id", "name", "type", "role", "properties", "evidence"],
        "properties": {
          "id": {"type": "string", "pattern": "^[a-z][a-z0-9_]*$", "description": "Short identifier referenced by subgoals."},
          "name": {"type": "string", "description": "Short visual noun phrase a detector can find: colour + noun."},
          "type": {"enum": ["rigid", "articulated", "deformable", "other"]},
          "role": {"enum": ["manipulated", "tool", "target", "container", "static"]},
          "parts": {"type": "array", "items": {"type": "string"}, "description": "Named parts when more than one matters (articulated objects always)."},
          "pieces": {
            "type": "object", "required": ["count", "kind"],
            "description": "Only for a group object: several separate, identical or similar pieces that the task treats as one thing (a tower of loose blocks, a pile, fan or pyramid of cards, a group of bricks taken one at a time). type, properties and size then describe one piece.",
            "properties": {
              "count": {"type": "integer", "minimum": 2, "description": "How many pieces the group has at the first frame."},
              "at_least": {"type": "boolean", "description": "true when only a lower bound can be counted (count is then the minimum). Default false."},
              "kind": {"type": "string", "description": "Singular noun for one piece: block, bar, card, brick, bead."},
              "loose": {"type": "boolean", "description": "true (default): the pieces are separate bodies held together only by gravity and friction, so one can be taken, slid or knocked off; false: they never separate in the task and may be rebuilt as one body."}
            }
          },
          "appearance": {"type": "object", "additionalProperties": {"type": "string"}, "description": "Colour, material, markings, per part when useful."},
          "approximate_size": {"type": "string", "description": "Qualitative or rough, read from the video: 'palm-sized', 'about as tall as the mug'."},
          "properties": {"type": "array", "minItems": 1, "items": {"type": "string"},
                         "description": "What the reconstruction must reproduce for the task to be possible, in natural language: mechanism, constraints, contact behaviour, what stays fixed."},
          "articulation": {
            "type": "object", "required": ["moving_part", "fixed_part", "joint_type", "axis", "state_over_video"],
            "properties": {
              "moving_part": {"type": "string"}, "fixed_part": {"type": "string"},
              "joint_type": {"enum": ["prismatic", "revolute", "screw", "free_part", "other"]},
              "axis": {"type": "string", "description": "Direction in words."},
              "range_observed": {"type": "string"},
              "state_over_video": {"type": "string", "description": "e.g. closed -> open -> closed"}
            }
          },
          "deformation": {"type": "object", "properties": {"kind": {"type": "string"}, "how_the_task_deforms_it": {"type": "string"}}},
          "initial_state": {"type": "string"},
          "final_state": {"type": "string"},
          "evidence": {"type": "string", "description": "Prompt words and the times or frames that confirm the object and its type."}
        }
      }
    },
    "subgoals": {
      "type": "array", "minItems": 1,
      "items": {
        "type": "object",
        "required": ["index", "acting_hand", "action", "object_refs", "motion", "hand_roles", "goal"],
        "properties": {
          "index": {"type": "integer", "minimum": 1},
          "acting_hand": {"enum": ["left", "right", "both"]},
          "action": {"type": "string", "description": "One motion, imperative, one sentence."},
          "object_refs": {"type": "array", "minItems": 1, "items": {"type": "string"}, "description": "Object ids involved; a part may follow a colon: drawer_unit:sliding_tray."},
          "motion": {"enum": ["grasp_lift", "carry", "place", "release", "hold", "push", "pull", "press", "open_joint", "close_joint",
                              "unscrew", "screw", "insert", "pour", "tilt", "cut", "write", "wipe", "tie", "fold", "regrasp", "other"]},
          "hand_roles": {"type": "object", "required": ["left", "right"], "properties": {"left": {"type": "string"}, "right": {"type": "string"}}},
          "goal": {"type": "string", "description": "An observable success condition for this subgoal."},
          "observed_outcome": {"type": "string", "description": "Only when what the video shows differs from the intended goal or cannot be resolved."},
          "time_window_s": {"type": "array", "items": {"type": "number"}, "minItems": 2, "maxItems": 2}
        }
      }
    },
    "task_success": {"type": "string", "description": "Every required final physical relation in words, using separate clauses and explicit object or part names; qualitative only."},
    "notes": {"type": "array", "items": {"type": "string"}}
  }
}
